<?xml version="1.0"?>
<schema xmlns="http://www.w3.org/2001/XMLSchema" xmlns:t="test" targetNamespace="test">

  <complexType name="base">
    <sequence>
      <element name="a" type="int"/>
    </sequence>
  </complexType>

  <element name="base" type="t:base"/>
  <element name="another-base" type="t:base" substitutionGroup="t:base"/>

  <complexType name="interm">
    <complexContent>
      <extension base="t:base">
        <sequence>
          <element name="b" type="int"/>
        </sequence>
      </extension>
    </complexContent>
  </complexType>

  <element name="interm" type="t:interm" substitutionGroup="t:base"/>

  <complexType name="derived">
    <complexContent>
      <extension base="t:interm">
        <sequence>
          <element name="c" type="int"/>
        </sequence>
      </extension>
    </complexContent>
  </complexType>

  <element name="derived" type="t:derived" substitutionGroup="t:interm"/>

  <complexType name="type">
    <sequence>
      <element ref="t:base" maxOccurs="unbounded"/>
    </sequence>
  </complexType>

  <element name="root" type="t:type"/>

</schema>
